{"assignmentId":"assignment-ulor-corin-summon-v2","assignmentSha256":"aef8120086a5780743e07298cd9e714a6109ab6c3ca93ce539ef2a22b5c1c20e","attempts":[{"attemptId":"ulor-corin-summon-v2-attempt-1","attemptNumber":1,"conclusion":"accepted-by-producer","exactPrompt":"Create one original Summonlab candidate summon portrait as a cinematic semi-realistic painted drawing. Use visible brush planes and controlled illustrative detail: not a photograph, not photoreal skin, not plastic 3D, and not cel anime. Portrait canvas 1024 x 1536. Exactly one weaponless adult, full body, three-quarter standing pose, with the entire head, both hands, both feet, hair, clothing, and all accessories fully inside a generous safe margin. Warm pale parchment studio wash, restrained warm color response, soft grounding shadow, no environmental story.\n\nNew identity Ulor Corin: 29-year-old woman, 179 cm (tall), conditioned athletic construction with functional tone but no ripped definition, skin value band-6-deepest. Face: broad oval face; large hooded eyes and a broken brow line; aquiline nose, softly full mouth; subtle age lines. Calm closed-mouth neutral expression with no smile, grin, or theatrical acting.\n\nHair: brown-chestnut, medium-loose, deliberate accent: wrapped side section. Wardrobe: mantle-short-cape, specifically a small mantle or short cape over an unarmored tunic and divided lower layers; offset closures and narrow reinforced cuffs; bounded palette plum-gray. Visible personal details: contrasting boot laces. Make unusual but bounded color blocking the primary recognition device. Maintenance cue: severe grooming softened by one unruly feature. Color treatment: keeps color restrained to layered edges. Pose cue: one shoulder leads subtly and the gaze meets the viewer without a smile. Include a folded handkerchief only as a quiet personal object, never as a weapon.\n\nThis is ordinary but intentionally designed 1-star mortal clothing. No weapon, armor, crown, magic, aura, or glow. No affinity cue, elemental gem, floating, frame, printed star, number, UI, logo, watermark, text, extra person, duplicated anatomy, cropped extremity, or published-character resemblance. Fantasy hair colors are matte dye or pigment, never supernatural emission. Preserve plausible anatomy while allowing the declared body construction to be extreme. Do not copy the reference's person, braid, clothes, pose, palette, progression, identity, body, hair, garments, ornaments, or markings.\n\nRESERVE ACTIVATION: This is a fresh base summon, not an edit or regeneration of any existing hero. Create the new identity described above using only the authorized rendering-style reference. Honor the complete activated physical manifest and reserve character kernel; no failed hero or failed candidate is a visual source.\n\nSOURCE-BOUND CORRECTION — this block is part of the immutable canonical prompt.\nCorrection mode: edit. Perform a precise edit of the supplied preceding candidate.\nExact preceding candidate: assets/heroes/experiments/one-star-overnight-200-001/waves/wave-04/candidates/ulor-corin/summon-v1.png\nExact preceding candidate SHA-256: 43ec125557c5939c61caba3546dd57723dcfa1959847f3bbee965e3ba5f0d5a6\nCorrect exactly this blocking defect: Restore the immutable band-6 deepest complexion while preserving every passing visual decision.\nPreserve every passing trait from the preceding candidate and every original invariant: the same hero identity, face and age cues, body construction, proportions, skin, hair construction, wardrobe silhouette and palette, accessories, markings, expression restraint, one-star mortal power ceiling, weaponless presentation, composition, canvas, and negative constraints. Do not opportunistically redesign any passing feature.","failureKind":null,"findings":[{"criterionId":"one-adult","evaluator":"producer","observation":"Exactly one coherent 29-year-old adult woman remains with one naturally connected body, no extra subject, and no duplicated anatomy.","outcome":"pass"},{"criterionId":"complete-full-body","evaluator":"producer","observation":"The complete head and wrapped-side hair, both hands, folded handkerchief, layered clothing, both lace-up boots, and grounding shadow remain fully inside generous parchment margins.","outcome":"pass"},{"criterionId":"painted-register","evaluator":"producer","observation":"The edit preserves visible brush planes, controlled illustrative modeling, textured cloth, restrained warm response, parchment wash, and soft grounding, with no photographic, plastic 3D, or cel-anime drift.","outcome":"pass"},{"criterionId":"manifest-fidelity","evaluator":"producer","observation":"Ulor now reads with an unmistakable band-6 deepest complexion while retaining her tall conditioned-athletic construction, broad oval mature face, hooded eyes, broken brow, aquiline nose, softly full mouth, subtle age cues, chestnut medium-loose wrapped-side hair, plum-gray short mantle, unarmored tunic, divided lower layers, offset closures, reinforced cuffs, restrained edge colors, unruly strand, leading shoulder, contrasting boot laces, and exactly one folded handkerchief.","outcome":"pass"},{"criterionId":"neutral-expression","evaluator":"producer","observation":"The same softly full mouth remains calmly closed beneath a steady direct gaze, without smile, grin, shout, or theatrical acting.","outcome":"pass"},{"criterionId":"one-star-ceiling","evaluator":"producer","observation":"The cloth mantle, tunic, divided layers, simple fastenings, laces, and handkerchief remain ordinary mortal details; no weapon, armor, crown, magic, aura, glow, affinity cue, gem, floating, frame, star, number, UI, text, logo, or watermark appears.","outcome":"pass"},{"criterionId":"original-identity","evaluator":"producer","observation":"Ulor's mature broad-oval female face, tall athletic build, loose chestnut wrapped-side hair, plum-gray mantle, layered outfit, contrasting laces, and handkerchief pose remain distinct from the rendering reference person, braid, physique, ochre garments, ornaments, palette, pose, and progression.","outcome":"pass"}],"generationCompletedAt":"2026-09-04T00:33:57.013Z","generationDurationMs":26977,"inspectionCompletedAt":"2026-09-04T00:34:46.206Z","inspectionDurationMs":49193,"persistence":{"operation":"anchored-exclusive-copy","retained":{"bytes":2418351,"height":1536,"mediaType":"image/png","path":"assets/heroes/experiments/one-star-overnight-200-001/waves/wave-04/candidates/ulor-corin/summon-v2.png","sha256":"b6606c496031365811f20a1303ce7bc65433cee645da365b5e58192927642faa","width":1024},"source":{"bytes":2418351,"height":1536,"mediaType":"image/png","outputId":"exec-ea1b90f6-62e6-4b56-84d1-5848f29b759e","path":"/home/joao/.codex/generated_images/01a06816-c417-7351-92c8-06207f86ec2b/exec-ea1b90f6-62e6-4b56-84d1-5848f29b759e.png","sha256":"b6606c496031365811f20a1303ce7bc65433cee645da365b5e58192927642faa","width":1024}},"precedingAttemptId":null,"promptSha256":"56ad4a16b25dd36ec1d16f461d1c2aa2125f64eb315bb7d0d691be84ffae5702","referenceInputs":[{"path":"assets/heroes/visuals/style-references/current-hero-rendering/ochre-braid-progression-reference.png","sha256":"5b4a0f09271bc0fd1914614d50c4977cef6db50373d6357e9c5811aebb94f946"},{"path":"assets/heroes/experiments/one-star-overnight-200-001/waves/wave-04/candidates/ulor-corin/summon-v1.png","sha256":"43ec125557c5939c61caba3546dd57723dcfa1959847f3bbee965e3ba5f0d5a6"}],"requestStartedAt":"2026-09-04T00:33:30.036Z","retryReason":null,"sourceOutput":{"bytes":2418351,"height":1536,"mediaType":"image/png","outputId":"exec-ea1b90f6-62e6-4b56-84d1-5848f29b759e","path":"/home/joao/.codex/generated_images/01a06816-c417-7351-92c8-06207f86ec2b/exec-ea1b90f6-62e6-4b56-84d1-5848f29b759e.png","sha256":"b6606c496031365811f20a1303ce7bc65433cee645da365b5e58192927642faa","width":1024},"totalWallTimeMs":76170}],"attestations":{"candidateOnly":true,"noSharedFilesEdited":true,"selfPromoted":false},"candidate":{"bytes":2418351,"height":1536,"mediaType":"image/png","path":"assets/heroes/experiments/one-star-overnight-200-001/waves/wave-04/candidates/ulor-corin/summon-v2.png","sha256":"b6606c496031365811f20a1303ce7bc65433cee645da365b5e58192927642faa","width":1024},"completedAt":"2026-09-04T00:34:46.206Z","experimentId":"one-star-overnight-200-001","failedCriteria":[],"producerId":"resume-galyn","resultId":"ulor-corin-summon-v2-result","schemaVersion":"hero-one-star-image-result-v1","selectedAttemptId":"ulor-corin-summon-v2-attempt-1","startedAt":"2026-09-04T00:33:30.036Z","status":"candidate","targetId":"ulor-corin-summon-v2","targetSha256":"b320092368e8ed2e9faa865a2d094c78e9bc8a26de92b47e0d923ba024c3c02c","totalWallTimeMs":76170,"writtenOutputPaths":["assets/heroes/experiments/one-star-overnight-200-001/waves/wave-04/candidates/ulor-corin/summon-v2.png","assets/heroes/experiments/one-star-overnight-200-001/waves/wave-04/results/ulor-corin/summon-v2.json"]}
