{"assignmentId":"raia-haleth-combat-chibi-v1-assignment","assignmentSha256":"e92cb7afa536b09c6e302bf04f26b8dc902f16c24ea8e90bd7c97e083d2dd8a7","attempts":[{"attemptId":"raia-haleth-combat-chibi-v1-attempt-1","attemptNumber":1,"conclusion":"rejected-by-producer","exactPrompt":"Create exactly one full-body Summonlab combat chibi derived only from the supplied verified summon portrait. Canvas 1024 x 1536. Keep the character an adult and unmistakably the exact same person; simplify shapes for a clean painterly combat-game chibi. PROPORTION LOCK: the complete head-and-hair unit occupies 32 to 36 percent of the standing figure height, producing 2.75 to 3.1 heads total. Use a clearly oversized adult head, compact torso, and shortened legs; never render a 3.5-head, 4-head, or tall-miniature figure. Preserve relative body widths without generic inflation of the body. Use a grounded ready-idle three-quarter pose, both empty hands and both feet completely visible, with a generous safe margin and a warm pale parchment studio wash.\n\nIdentity continuity: Raia Haleth, age 29, gender presentation woman, skin-value band 2; soft rectangular face; large hooded eyes and a broken brow line; small upturned nose, heavy lower lip; one brow notch Preserve adult age cues, face geometry, skin, and expression; use a calm closed mouth with no smile or theatrical acting. Enlarge the cranium for chibi scale without replacing the source eye shape, eye spacing, brow structure, nose, mouth, jaw, or cheek planes with a shared generic doll-face template; the roster must retain visibly different adult faces at combat scale. Body continuity: plus-size-heavy, medium; 168 cm; plus-size heavy construction with substantial natural mass. Preserve shoulder and torso width, mass, softness, muscle distribution, upper-arm and forearm girth, wrist scale, hand size, leg mass, and posture. Do not make the arms, hands, shoulders, torso, or body fatter or bulkier merely because this is chibi. Tall or slight identity must read through shape and posture without shrinking the head below the required chibi ratio.\n\nHair continuity: dark-brown braids-twists-locs; accent: none. Preserve the front and side silhouette of braids-twists-locs, the parting, gathered mass, shaved areas, and none; color remains dark-brown. Wardrobe continuity: apron-workwear-layers in teal-brown; a work shirt, asymmetrical apron layers, reinforced trousers, and sturdy shoes; visible hand repairs and contrasting inner edges. Condition: severe grooming softened by one unruly feature. Preserve every visible seam, repair, closure, accessory, tattoo, marking, and palette relationship that survives at chibi scale. Personal anchors: a narrow bracelet stack; a hand-painted hem mark. Add nothing new.\n\nThe sole reference is the exact candidate authorized by summon target raia-haleth-summon-v2 and verified result raia-haleth-summon-v2-result at assets/heroes/experiments/one-star-overnight-200-001/waves/wave-06/results/raia-haleth/summon-v2.json; these identifiers are provenance only and must not appear in the image. No other identity, anatomy, wardrobe, or style reference is authorized. No weapon, attack, armor upgrade, magic, aura, glow, affinity cue, elemental gem, floating, frame, star, number, UI, text, label, logo, watermark, extra person, duplicate anatomy, cropped extremity, baby proportions, photographic finish, plastic 3D, or published-character resemblance.","failureKind":null,"findings":[{"criterionId":"identity-continuity","evaluator":"producer","observation":"The combat chibi remains recognizably the adult Raia through her light skin, soft rectangular face, large hooded eyes, broken brow line and notch, small upturned nose, heavy closed lower lip, and calm direct gaze; the enlarged head retains mature facial planes rather than baby cues.","outcome":"pass"},{"criterionId":"body-continuity","evaluator":"producer","observation":"Her plus-size-heavy construction and substantial natural mass remain clear in broad shoulders, wide soft torso, full middle, heavy legs, and grounded posture without generic additional body inflation.","outcome":"pass"},{"criterionId":"arm-hand-continuity","evaluator":"producer","observation":"Upper arms, forearms, wrists, and hands preserve the source’s naturally substantial proportions; the lowered fists remain proportionate to her frame rather than generically oversized.","outcome":"pass"},{"criterionId":"hair-continuity","evaluator":"producer","observation":"The dark-brown braids, twists, and locs preserve the source’s front parting, large gathered crown and side mass, multiple loose ends, and severe grooming softened by an unruly lock.","outcome":"pass"},{"criterionId":"wardrobe-continuity","evaluator":"producer","observation":"The teal-brown work shirt, asymmetric layered apron, repairs, contrasting edges, reinforced trousers, sturdy shoes, narrow bracelet stack, hand-painted triangular hem mark, and worn teal thread spool are preserved. Strict continuity fails because two gold hoop earrings are newly added even though accepted summon-v2 has no ear hardware and the target says add nothing new.","outcome":"fail"},{"criterionId":"chibi-ratio","evaluator":"producer","observation":"Original-resolution visual measurement places the complete head-and-hair unit at approximately y=121–565 and total standing height at y=121–1427: about 444/1306 = 34.0%, unambiguously inside the frozen 32–36% band (about 2.94 heads tall).","outcome":"pass"},{"criterionId":"complete-full-body","evaluator":"producer","observation":"Exactly one subject appears; the complete loc silhouette, both empty hands, layered apron, both sturdy boots, and grounding shadow remain fully inside generous canvas margins with no crop or duplicated anatomy.","outcome":"pass"},{"criterionId":"combat-readability","evaluator":"producer","observation":"Lowered fists, planted offset boots, squared shoulders, broad silhouette, and strong teal-brown value separation read clearly as a grounded weaponless ready-idle pose at combat-icon scale.","outcome":"pass"},{"criterionId":"one-star-ceiling","evaluator":"producer","observation":"The repaired work shirt, apron, reinforced trousers, worn boots, bracelets, hem paint, thread spool, and small earrings remain ordinary mortal items; no weapon, armor upgrade, magic, aura, glow, affinity cue, gem, floating, frame, star, number, UI, text, logo, watermark, or supernatural effect appears.","outcome":"pass"}],"generationCompletedAt":"2026-09-03T23:35:22.646Z","generationDurationMs":22800,"inspectionCompletedAt":"2026-09-03T23:36:56.598Z","inspectionDurationMs":93952,"persistence":{"operation":"anchored-exclusive-copy","retained":{"bytes":2496468,"height":1536,"mediaType":"image/png","path":"assets/heroes/experiments/one-star-overnight-200-001/waves/wave-06/candidates/raia-haleth/combat-chibi-v1.png","sha256":"261fdc44dcd0fbdfc5440ef8e388d0a9cf6955b368b39be0358f8a89c13c87f7","width":1024},"source":{"bytes":2496468,"height":1536,"mediaType":"image/png","outputId":"exec-1a65c5b4-e26b-4d2b-a566-0d5b4e50f2f1","path":"/home/joao/.codex/generated_images/01a06816-1ff8-7f93-9fb6-c1619a5d5156/exec-1a65c5b4-e26b-4d2b-a566-0d5b4e50f2f1.png","sha256":"261fdc44dcd0fbdfc5440ef8e388d0a9cf6955b368b39be0358f8a89c13c87f7","width":1024}},"precedingAttemptId":null,"promptSha256":"ec4b93b6d6ee05cd7dbb517d1227d3728dda7124397ea8abd09ec7639414096c","referenceInputs":[{"path":"assets/heroes/experiments/one-star-overnight-200-001/waves/wave-06/candidates/raia-haleth/summon-v2.png","sha256":"36a59ea53ab665927a45be4be1cfc02e2504f96e7058896348bf72fd02861005"}],"requestStartedAt":"2026-09-03T23:34:59.846Z","retryReason":"Wardrobe continuity is not exact because two undeclared gold hoop earrings were added even though summon-v2 has no ear hardware. Any separately assigned correction should remove only both hoops while preserving every passing identity, body, arms, hair, workwear, bracelet, hem mark, thread spool, 34.0% ratio, full-body, combat, and one-star trait. No correction was authorized for this task.","sourceOutput":{"bytes":2496468,"height":1536,"mediaType":"image/png","outputId":"exec-1a65c5b4-e26b-4d2b-a566-0d5b4e50f2f1","path":"/home/joao/.codex/generated_images/01a06816-1ff8-7f93-9fb6-c1619a5d5156/exec-1a65c5b4-e26b-4d2b-a566-0d5b4e50f2f1.png","sha256":"261fdc44dcd0fbdfc5440ef8e388d0a9cf6955b368b39be0358f8a89c13c87f7","width":1024},"totalWallTimeMs":116752}],"attestations":{"candidateOnly":true,"noSharedFilesEdited":true,"selfPromoted":false},"candidate":{"bytes":2496468,"height":1536,"mediaType":"image/png","path":"assets/heroes/experiments/one-star-overnight-200-001/waves/wave-06/candidates/raia-haleth/combat-chibi-v1.png","sha256":"261fdc44dcd0fbdfc5440ef8e388d0a9cf6955b368b39be0358f8a89c13c87f7","width":1024},"completedAt":"2026-09-03T23:36:56.598Z","experimentId":"one-star-overnight-200-001","failedCriteria":["wardrobe-continuity"],"producerId":"resume-lano","resultId":"raia-haleth-combat-chibi-v1-result","schemaVersion":"hero-one-star-image-result-v1","selectedAttemptId":null,"startedAt":"2026-09-03T23:34:59.846Z","status":"revise","targetId":"raia-haleth-combat-chibi-v1","targetSha256":"4c4dfcf9ba4f763964861827c91f0eab83954a504abfcea3d87a130d5bf16fab","totalWallTimeMs":116752,"writtenOutputPaths":["assets/heroes/experiments/one-star-overnight-200-001/waves/wave-06/candidates/raia-haleth/combat-chibi-v1.png","assets/heroes/experiments/one-star-overnight-200-001/waves/wave-06/results/raia-haleth/combat-chibi-v1.json"]}
