{"assignmentId":"joryn-haleth-summon-v1-assignment","assignmentSha256":"d382d70d86d493605a28d45e3cba8c7191649c17bd2912a9669ee3eb9c60ed89","attempts":[{"attemptId":"joryn-haleth-summon-v1-attempt-1","attemptNumber":1,"conclusion":"accepted-by-producer","exactPrompt":"Create one original Summonlab candidate summon portrait as a cinematic semi-realistic painted drawing. Use visible brush planes and controlled illustrative detail: not a photograph, not photoreal skin, not plastic 3D, and not cel anime. Portrait canvas 1024 x 1536. Exactly one weaponless adult, full body, three-quarter standing pose, with the entire head, both hands, both feet, hair, clothing, and all accessories fully inside a generous safe margin. Warm pale parchment studio wash, restrained warm color response, soft grounding shadow, no environmental story.\n\nNew identity Joryn Haleth: 22-year-old woman, 190 cm (very-tall), sturdy stocky construction with a broad frame and compact proportions, skin value band-6-deepest. Face: soft rectangular face; high cheekbones and softly lidded eyes; small upturned nose, heavy lower lip; no added facial mark. Calm closed-mouth neutral expression with no smile, grin, or theatrical acting.\n\nHair: dark-brown, long-loose, deliberate accent: none. Wardrobe: fitted-vest-system, specifically a fitted cloth vest system over a soft shirt, high-waist trousers, and flexible boots; offset closures and narrow reinforced cuffs; bounded palette ochre-cream. Visible personal details: no accessory and no tattoo. Make stitching, quilting, embroidery, or woven pattern the primary recognition device. Maintenance cue: low-maintenance grooming with highly polished footwear. Color treatment: lets faded and repaired areas vary the palette. Pose cue: one thumb hooks lightly beneath the waist wrap while the other hand rests open. Include a small empty medicine pouch only as a quiet personal object, never as a weapon.\n\nThis is ordinary but intentionally designed 1-star mortal clothing. No weapon, armor, crown, magic, aura, or glow. No affinity cue, elemental gem, floating, frame, printed star, number, UI, logo, watermark, text, extra person, duplicated anatomy, cropped extremity, or published-character resemblance. Fantasy hair colors are matte dye or pigment, never supernatural emission. Preserve plausible anatomy while allowing the declared body construction to be extreme. Do not copy the reference's person, braid, clothes, pose, palette, progression, identity, body, hair, garments, ornaments, or markings.\n\nRESERVE ACTIVATION: This is a fresh base summon, not an edit or regeneration of any existing hero. Create the new identity described above using only the authorized rendering-style reference. Honor the complete activated physical manifest and reserve character kernel; no failed hero or failed candidate is a visual source.","failureKind":null,"findings":[{"criterionId":"one-adult","evaluator":"producer","observation":"Exactly one clearly adult 22-year-old woman appears with coherent anatomy and no duplicated body parts.","outcome":"pass"},{"criterionId":"complete-full-body","evaluator":"producer","observation":"The full long-loose hair silhouette, both hands, medicine pouch, trousers, and both complete polished boots remain comfortably inside generous parchment margins.","outcome":"pass"},{"criterionId":"painted-register","evaluator":"producer","observation":"Visible faceted brush planes, illustrative cloth texture, softened edges, restrained highlights, parchment wash, and painterly skin treatment read as cinematic semi-realistic painting rather than photography, plastic 3D, or cel anime.","outcome":"pass"},{"criterionId":"manifest-fidelity","evaluator":"producer","observation":"Joryn reads very tall and sturdy-stocky with a broad frame, deepest-brown skin, soft rectangular face, high cheekbones, softly lidded eyes, small upturned nose, heavy lower lip, long loose dark-brown hair, ochre-cream fitted vest system, soft shirt, high-waist repaired trousers, narrow reinforced cuffs, flexible highly polished boots, dense textile stitching, no tattoo or jewelry, and one small empty medicine pouch. One thumb hooks beneath the waist wrap while the other hand rests open.","outcome":"pass"},{"criterionId":"neutral-expression","evaluator":"producer","observation":"Her mouth is calmly closed and unsmiling; the softly lidded gaze is reserved and neutral without grin or theatrical acting.","outcome":"pass"},{"criterionId":"one-star-ceiling","evaluator":"producer","observation":"All recognition comes from repaired practical cloth, woven construction, ordinary closures, and polished footwear; there is no weapon, armor, crown, magic, aura, glow, affinity cue, gem, floating, frame, star, number, UI, logo, watermark, or text.","outcome":"pass"},{"criterionId":"original-identity","evaluator":"producer","observation":"The new soft-rectangular face, broad very-tall stocky body, long loose wavy hair, fitted vest, high-waist trousers, medicine pouch, and pose are distinct from the style reference’s person, extreme side braid, layered robe, progression layout, and identity.","outcome":"pass"}],"generationCompletedAt":"2026-09-03T20:45:27.388Z","generationDurationMs":42300,"inspectionCompletedAt":"2026-09-03T20:46:09.592Z","inspectionDurationMs":42204,"persistence":{"operation":"anchored-exclusive-copy","retained":{"bytes":2517074,"height":1536,"mediaType":"image/png","path":"assets/heroes/experiments/one-star-overnight-200-001/waves/wave-06/candidates/joryn-haleth/summon-v1.png","sha256":"6039e52ce5d4d0b1f304be46d85b2252376a9b8698065e7286eec825d29c88b0","width":1024},"source":{"bytes":2517074,"height":1536,"mediaType":"image/png","outputId":"exec-37643747-d7c6-4980-9fb9-47f2ca83a1b0","path":"/home/joao/.codex/generated_images/01a06815-3235-7021-9609-56299385d72d/exec-37643747-d7c6-4980-9fb9-47f2ca83a1b0.png","sha256":"6039e52ce5d4d0b1f304be46d85b2252376a9b8698065e7286eec825d29c88b0","width":1024}},"precedingAttemptId":null,"promptSha256":"df077d01efcaeb71cb96c795dd292e2b24d89fbdfe268198ed8c82dba684b7f7","referenceInputs":[{"path":"assets/heroes/visuals/style-references/current-hero-rendering/ochre-braid-progression-reference.png","sha256":"5b4a0f09271bc0fd1914614d50c4977cef6db50373d6357e9c5811aebb94f946"}],"requestStartedAt":"2026-09-03T20:44:45.088Z","retryReason":null,"sourceOutput":{"bytes":2517074,"height":1536,"mediaType":"image/png","outputId":"exec-37643747-d7c6-4980-9fb9-47f2ca83a1b0","path":"/home/joao/.codex/generated_images/01a06815-3235-7021-9609-56299385d72d/exec-37643747-d7c6-4980-9fb9-47f2ca83a1b0.png","sha256":"6039e52ce5d4d0b1f304be46d85b2252376a9b8698065e7286eec825d29c88b0","width":1024},"totalWallTimeMs":84504}],"attestations":{"candidateOnly":true,"noSharedFilesEdited":true,"selfPromoted":false},"candidate":{"bytes":2517074,"height":1536,"mediaType":"image/png","path":"assets/heroes/experiments/one-star-overnight-200-001/waves/wave-06/candidates/joryn-haleth/summon-v1.png","sha256":"6039e52ce5d4d0b1f304be46d85b2252376a9b8698065e7286eec825d29c88b0","width":1024},"completedAt":"2026-09-03T20:46:09.592Z","experimentId":"one-star-overnight-200-001","failedCriteria":[],"producerId":"resume-fena","resultId":"joryn-haleth-summon-v1-result","schemaVersion":"hero-one-star-image-result-v1","selectedAttemptId":"joryn-haleth-summon-v1-attempt-1","startedAt":"2026-09-03T20:44:45.088Z","status":"candidate","targetId":"joryn-haleth-summon-v1","targetSha256":"655ebf32ebee24f15f07f87800145ca18613f1ff5c9450cd16ac8567a93c9ea4","totalWallTimeMs":84504,"writtenOutputPaths":["assets/heroes/experiments/one-star-overnight-200-001/waves/wave-06/candidates/joryn-haleth/summon-v1.png","assets/heroes/experiments/one-star-overnight-200-001/waves/wave-06/results/joryn-haleth/summon-v1.json"]}
