{"assignmentId":"brinis-tavel-summon-v1-assignment","assignmentSha256":"84b564d0a44f8a727ab6c79c3583f15e44b451bccd4a7fdc52a3e7997d18c62e","attempts":[{"attemptId":"brinis-tavel-summon-v1-attempt-1","attemptNumber":1,"conclusion":"accepted-by-producer","exactPrompt":"Create one original Summonlab candidate summon portrait as a cinematic semi-realistic painted drawing. Use visible brush planes and controlled illustrative detail: not a photograph, not photoreal skin, not plastic 3D, and not cel anime. Portrait canvas 1024 x 1536. Exactly one weaponless adult, full body, three-quarter standing pose, with the entire head, both hands, both feet, hair, clothing, and all accessories fully inside a generous safe margin. Warm pale parchment studio wash, restrained warm color response, soft grounding shadow, no environmental story.\n\nNew identity Brinis Tavel: 37-year-old man, 186 cm (tall), soft rounded construction with an evident middle and gentle limb contours, skin value band-4-medium. Face: heart-shaped face; deep-set eyes and a heavy level brow; small upturned nose, heavy lower lip; no added facial mark. Calm closed-mouth neutral expression with no smile, grin, or theatrical acting.\n\nHair: multicolor-split-streak, braids-twists-locs, deliberate accent: none. Wardrobe: asymmetric-patchwork, specifically intentional patchwork layers with an uneven hem, visible repairs, and practical trousers; a divided hem and broad folded collar; bounded palette rust-charcoal. Visible personal details: one small nape tattoo. Make the garment hem and outer silhouette the primary recognition device. Maintenance cue: low-maintenance grooming with highly polished footwear. Color treatment: uses small rhythmic repeats of the palette. Pose cue: weight settles into one heel, shoulders square, hands relaxed and completely visible. Include a wooden thread gauge only as a quiet personal object, never as a weapon.\n\nThis is ordinary but intentionally designed 1-star mortal clothing. No weapon, armor, crown, magic, aura, or glow. No affinity cue, elemental gem, floating, frame, printed star, number, UI, logo, watermark, text, extra person, duplicated anatomy, cropped extremity, or published-character resemblance. Fantasy hair colors are matte dye or pigment, never supernatural emission. Preserve plausible anatomy while allowing the declared body construction to be extreme. Do not copy the reference's person, braid, clothes, pose, palette, progression, identity, body, hair, garments, ornaments, or markings.\n\nRESERVE ACTIVATION: This is a fresh base summon, not an edit or regeneration of any existing hero. Create the new identity described above using only the authorized rendering-style reference. Honor the complete activated physical manifest and reserve character kernel; no failed hero or failed candidate is a visual source.","failureKind":null,"findings":[{"criterionId":"one-adult","evaluator":"producer","observation":"Exactly one mature adult man appears with one coherent full body, two hands, two legs, and no duplicate anatomy.","outcome":"pass"},{"criterionId":"complete-full-body","evaluator":"producer","observation":"The entire loc silhouette, both relaxed hands, the wooden thread gauge, every asymmetric patchwork hem, practical trousers, and both polished shoes remain fully visible inside generous parchment margins.","outcome":"pass"},{"criterionId":"painted-register","evaluator":"producer","observation":"Visible brush planes across skin, hair, repaired textiles, and footwear combine with controlled illustrative detail, warm parchment wash, and a soft grounding shadow; the finish is cinematic semi-realistic painting rather than photography, plastic 3D, or cel anime.","outcome":"pass"},{"criterionId":"manifest-fidelity","evaluator":"producer","observation":"Brinis reads as a tall 37-year-old band-4 man with a soft rounded middle and gentle limb contours; deep-set eyes, heavy level brow, small upturned nose, heavy lower lip, multicolor split-streak braids/twists/locs, rust-charcoal asymmetric repaired patchwork, broad folded collar, uneven divided hem, practical trousers, one connected small nape tattoo, highly polished footwear, rhythmic palette repeats, one-heel weight, and a wooden thread gauge are legible.","outcome":"pass"},{"criterionId":"neutral-expression","evaluator":"producer","observation":"The level brows, settled eyes, and closed heavy-lipped mouth read calm and neutral without smile, grin, or theatrical acting.","outcome":"pass"},{"criterionId":"one-star-ceiling","evaluator":"producer","observation":"The hero remains an ordinary mortal in repaired cloth layers. The hand object reads as the specified wooden thread gauge through its open shuttle-like wooden body and central measuring spindle, not as a blade or weapon; no armor, crown, magic, aura, glow, affinity cue, gem, floating, frame, star, number, UI, text, logo, or watermark appears.","outcome":"pass"},{"criterionId":"original-identity","evaluator":"producer","observation":"Brinis has a distinct male heart-shaped face, tall soft-round body, multicolor loc construction, rust-charcoal patched workwear, nape tattoo, thread gauge, and relaxed weighted stance; none reproduce the reference woman, long single braid, slim anatomy, ochre layered outfit, ornaments, pose, or progression effects.","outcome":"pass"}],"generationCompletedAt":"2026-09-04T01:01:17.450Z","generationDurationMs":32000,"inspectionCompletedAt":"2026-09-04T01:02:43.733Z","inspectionDurationMs":86283,"persistence":{"operation":"anchored-exclusive-copy","retained":{"bytes":2535558,"height":1536,"mediaType":"image/png","path":"assets/heroes/experiments/one-star-overnight-200-001/waves/wave-08/candidates/brinis-tavel/summon-v1.png","sha256":"c73477c97df05f66ca7f4dd0b80f24d78cbd9b67c9d4e9aa1ed72b8a34fa6041","width":1024},"source":{"bytes":2535558,"height":1536,"mediaType":"image/png","outputId":"exec-d654d771-027e-46f6-af9a-ff65a78ca5b6","path":"/home/joao/.codex/generated_images/01a0688e-cef4-7df2-944f-860ceb28b3ae/exec-d654d771-027e-46f6-af9a-ff65a78ca5b6.png","sha256":"c73477c97df05f66ca7f4dd0b80f24d78cbd9b67c9d4e9aa1ed72b8a34fa6041","width":1024}},"precedingAttemptId":null,"promptSha256":"1c414cb6e2db35e1a277cd3dd678754bd3d073a1e39f0d327be68eaf3c54e43d","referenceInputs":[{"path":"assets/heroes/visuals/style-references/current-hero-rendering/ochre-braid-progression-reference.png","sha256":"5b4a0f09271bc0fd1914614d50c4977cef6db50373d6357e9c5811aebb94f946"}],"requestStartedAt":"2026-09-04T01:00:45.450Z","retryReason":null,"sourceOutput":{"bytes":2535558,"height":1536,"mediaType":"image/png","outputId":"exec-d654d771-027e-46f6-af9a-ff65a78ca5b6","path":"/home/joao/.codex/generated_images/01a0688e-cef4-7df2-944f-860ceb28b3ae/exec-d654d771-027e-46f6-af9a-ff65a78ca5b6.png","sha256":"c73477c97df05f66ca7f4dd0b80f24d78cbd9b67c9d4e9aa1ed72b8a34fa6041","width":1024},"totalWallTimeMs":118283}],"attestations":{"candidateOnly":true,"noSharedFilesEdited":true,"selfPromoted":false},"candidate":{"bytes":2535558,"height":1536,"mediaType":"image/png","path":"assets/heroes/experiments/one-star-overnight-200-001/waves/wave-08/candidates/brinis-tavel/summon-v1.png","sha256":"c73477c97df05f66ca7f4dd0b80f24d78cbd9b67c9d4e9aa1ed72b8a34fa6041","width":1024},"completedAt":"2026-09-04T01:02:43.733Z","experimentId":"one-star-overnight-200-001","failedCriteria":[],"producerId":"produce-lanon","resultId":"brinis-tavel-summon-v1-result","schemaVersion":"hero-one-star-image-result-v1","selectedAttemptId":"brinis-tavel-summon-v1-attempt-1","startedAt":"2026-09-04T01:00:45.450Z","status":"candidate","targetId":"brinis-tavel-summon-v1","targetSha256":"76939ebea92bac4a9a614e4ce9d6058564f8318b27ca59f5914e587cd1401875","totalWallTimeMs":118283,"writtenOutputPaths":["assets/heroes/experiments/one-star-overnight-200-001/waves/wave-08/candidates/brinis-tavel/summon-v1.png","assets/heroes/experiments/one-star-overnight-200-001/waves/wave-08/results/brinis-tavel/summon-v1.json"]}
