{"assignmentId":"peria-halo-summon-v1-assignment","assignmentSha256":"63cde0473db46fd849a5f8f9c71cf077c1ac646b03aabf3c8f7c34ede80aeeca","attempts":[{"attemptId":"peria-halo-summon-v1-attempt-1","attemptNumber":1,"conclusion":"rejected-by-producer","exactPrompt":"Create one original Summonlab candidate summon portrait as a cinematic semi-realistic painted drawing. Use visible brush planes and controlled illustrative detail: not a photograph, not photoreal skin, not plastic 3D, and not cel anime. Portrait canvas 1024 x 1536. Exactly one weaponless adult, full body, three-quarter standing pose, with the entire head, both hands, both feet, hair, clothing, and all accessories fully inside a generous safe margin. Warm pale parchment studio wash, restrained warm color response, soft grounding shadow, no environmental story.\n\nNew identity Peria Halo: 19-year-old woman, 169 cm (medium), conditioned athletic construction with functional tone but no ripped definition, skin value band-5-medium-deep. Face: square compact face; large hooded eyes and a broken brow line; aquiline nose, softly full mouth; faint freckles. Calm closed-mouth neutral expression with no smile, grin, or theatrical acting.\n\nHair: gray-white-silver, asymmetric-extreme, deliberate accent: dramatic contrasting side length. Wardrobe: draped-robe, specifically a draped robe whose belting and openings keep the body construction legible; offset closures and narrow reinforced cuffs; bounded palette ochre-cream. Visible personal details: a hand-painted hem mark; two plain rings. Make the hair construction the primary recognition silhouette. Maintenance cue: immaculate clothes over weathered hands. Color treatment: uses the palette boldly in large blocks. Pose cue: weight settles into one heel, shoulders square, hands relaxed and completely visible. Include a wooden thread gauge only as a quiet personal object, never as a weapon.\n\nThis is ordinary but intentionally designed 1-star mortal clothing. No weapon, armor, crown, magic, aura, or glow. No affinity cue, elemental gem, floating, frame, printed star, number, UI, logo, watermark, text, extra person, duplicated anatomy, cropped extremity, or published-character resemblance. Fantasy hair colors are matte dye or pigment, never supernatural emission. Preserve plausible anatomy while allowing the declared body construction to be extreme. Do not copy the reference's person, braid, clothes, pose, palette, progression, identity, body, hair, garments, ornaments, or markings.\n\nRESERVE ACTIVATION: This is a fresh base summon, not an edit or regeneration of any existing hero. Create the new identity described above using only the authorized rendering-style reference. Honor the complete activated physical manifest and reserve character kernel; no failed hero or failed candidate is a visual source.","failureKind":null,"findings":[{"criterionId":"one-adult","evaluator":"producer","observation":"Original-resolution inspection shows exactly one plausibly adult 19-year-old woman with coherent, unduplicated anatomy.","outcome":"pass"},{"criterionId":"complete-full-body","evaluator":"producer","observation":"The complete silver hair silhouette, head, both relaxed hands, wooden thread gauge, robe hem, both boots, and grounding shadow remain fully visible inside generous margins.","outcome":"pass"},{"criterionId":"painted-register","evaluator":"producer","observation":"Visible brush planes, simplified textile and skin rendering, controlled illustrative edges, and a parchment wash establish a cinematic semi-realistic painting rather than photography, plastic 3D, or cel anime.","outcome":"pass"},{"criterionId":"manifest-fidelity","evaluator":"producer","observation":"The square compact face, hooded eyes, broken brow, aquiline nose, faint freckles, band-5 skin, athletic build, extreme asymmetric gray-white hair, ochre-cream draped robe, painted hem mark, two plain finger rings, weathered hands, and wooden thread gauge are legible, but an additional beaded loop/ornament hangs from the waist tie; this undeclared third personal detail exceeds the exact manifest.","outcome":"fail"},{"criterionId":"neutral-expression","evaluator":"producer","observation":"The mouth is closed and unsmiling, with a calm restrained gaze and no theatrical acting.","outcome":"pass"},{"criterionId":"one-star-ceiling","evaluator":"producer","observation":"The presentation remains an ordinary mortal in textile clothing, with no weapon, armor, crown, magic, aura, glow, affinity cue, gem, floating element, frame, star, number, UI, text, logo, or watermark.","outcome":"pass"},{"criterionId":"original-identity","evaluator":"producer","observation":"The new square-faced freckled young adult, loose extreme silver asymmetry, athletic build, draped robe construction, painted hem, rings, and thread gauge do not reproduce the style plate person, black braid, outfit, body, pose, or progression.","outcome":"pass"}],"generationCompletedAt":"2026-09-03T23:01:05.598Z","generationDurationMs":40457,"inspectionCompletedAt":"2026-09-03T23:02:12.670Z","inspectionDurationMs":67072,"persistence":{"operation":"anchored-exclusive-copy","retained":{"bytes":2447339,"height":1536,"mediaType":"image/png","path":"assets/heroes/experiments/one-star-overnight-200-001/waves/wave-04/candidates/peria-halo/summon-v1.png","sha256":"79df5ae40d01227861d0dad6c098f263b67036dd8624144147684ec886c9fce7","width":1024},"source":{"bytes":2447339,"height":1536,"mediaType":"image/png","outputId":"exec-9ba6398b-dec0-40ad-afb5-c6e77e08a62e","path":"/home/joao/.codex/generated_images/01a06815-dc3d-73e0-a816-7111d363f75b/exec-9ba6398b-dec0-40ad-afb5-c6e77e08a62e.png","sha256":"79df5ae40d01227861d0dad6c098f263b67036dd8624144147684ec886c9fce7","width":1024}},"precedingAttemptId":null,"promptSha256":"3a0ca07338092a0e9cbf88319cff718fd650a89c7936434253f8a62f485f7fda","referenceInputs":[{"path":"assets/heroes/visuals/style-references/current-hero-rendering/ochre-braid-progression-reference.png","sha256":"5b4a0f09271bc0fd1914614d50c4977cef6db50373d6357e9c5811aebb94f946"}],"requestStartedAt":"2026-09-03T23:00:25.141Z","retryReason":"Remove only the undeclared beaded loop/ornament dangling from the waist while preserving the authorized wooden thread gauge, painted hem mark, exactly two plain rings, and all other passing traits. The explicit one-call assignment boundary forbids a correction call in this target version.","sourceOutput":{"bytes":2447339,"height":1536,"mediaType":"image/png","outputId":"exec-9ba6398b-dec0-40ad-afb5-c6e77e08a62e","path":"/home/joao/.codex/generated_images/01a06815-dc3d-73e0-a816-7111d363f75b/exec-9ba6398b-dec0-40ad-afb5-c6e77e08a62e.png","sha256":"79df5ae40d01227861d0dad6c098f263b67036dd8624144147684ec886c9fce7","width":1024},"totalWallTimeMs":107529}],"attestations":{"candidateOnly":true,"noSharedFilesEdited":true,"selfPromoted":false},"candidate":{"bytes":2447339,"height":1536,"mediaType":"image/png","path":"assets/heroes/experiments/one-star-overnight-200-001/waves/wave-04/candidates/peria-halo/summon-v1.png","sha256":"79df5ae40d01227861d0dad6c098f263b67036dd8624144147684ec886c9fce7","width":1024},"completedAt":"2026-09-03T23:02:12.670Z","experimentId":"one-star-overnight-200-001","failedCriteria":["manifest-fidelity"],"producerId":"resume-adon","resultId":"peria-halo-summon-v1-result","schemaVersion":"hero-one-star-image-result-v1","selectedAttemptId":null,"startedAt":"2026-09-03T23:00:25.141Z","status":"revise","targetId":"peria-halo-summon-v1","targetSha256":"168b1ff51c1e767a32acfd2b55bbbb183c449c4fa7bade061911b27daf2382f9","totalWallTimeMs":107529,"writtenOutputPaths":["assets/heroes/experiments/one-star-overnight-200-001/waves/wave-04/candidates/peria-halo/summon-v1.png","assets/heroes/experiments/one-star-overnight-200-001/waves/wave-04/results/peria-halo/summon-v1.json"]}
