{"assignmentId":"delyn-dreno-summon-v1-assignment","assignmentSha256":"cfd0ee4fed2c288f0930887d9a655841da00634497c7f00238310d04c912f818","attempts":[{"attemptId":"delyn-dreno-summon-v1-attempt-1","attemptNumber":1,"conclusion":"rejected-by-producer","exactPrompt":"Create one original Summonlab candidate summon portrait as a cinematic semi-realistic painted drawing. Use visible brush planes and controlled illustrative detail: not a photograph, not photoreal skin, not plastic 3D, and not cel anime. Portrait canvas 1024 x 1536. Exactly one weaponless adult, full body, three-quarter standing pose, with the entire head, both hands, both feet, hair, clothing, and all accessories fully inside a generous safe margin. Warm pale parchment studio wash, restrained warm color response, soft grounding shadow, no environmental story.\n\nNew identity Delyn Dreno: 29-year-old woman, 175 cm (medium), soft rounded construction with an evident middle and gentle limb contours, skin value band-4-medium. Face: wide triangular face; high cheekbones and softly lidded eyes; aquiline nose, softly full mouth; subtle age lines. Calm closed-mouth neutral expression with no smile, grin, or theatrical acting.\n\nHair: black, shaved-close-cropped, deliberate accent: none. Wardrobe: fitted-vest-system, specifically a fitted cloth vest system over a soft shirt, high-waist trousers, and flexible boots; offset closures and narrow reinforced cuffs; bounded palette plum-gray. Visible personal details: no accessory and no tattoo. Make the hair construction the primary recognition silhouette. Maintenance cue: practical grooming with one carefully perfected detail. Color treatment: uses small rhythmic repeats of the palette. Pose cue: one shoulder leads subtly and the gaze meets the viewer without a smile. Include a polished seed case only as a quiet personal object, never as a weapon.\n\nThis is ordinary but intentionally designed 1-star mortal clothing. No weapon, armor, crown, magic, aura, or glow. No affinity cue, elemental gem, floating, frame, printed star, number, UI, logo, watermark, text, extra person, duplicated anatomy, cropped extremity, or published-character resemblance. Fantasy hair colors are matte dye or pigment, never supernatural emission. Preserve plausible anatomy while allowing the declared body construction to be extreme. Do not copy the reference's person, braid, clothes, pose, palette, progression, identity, body, hair, garments, ornaments, or markings.\n\nRESERVE ACTIVATION: This is a fresh base summon, not an edit or regeneration of any existing hero. Create the new identity described above using only the authorized rendering-style reference. Honor the complete activated physical manifest and reserve character kernel; no failed hero or failed candidate is a visual source.","failureKind":null,"findings":[{"criterionId":"one-adult","evaluator":"producer","observation":"Exactly one coherent adult woman appears, with one complete head and body, two natural arms and readable hands, and two legs and feet; no extra subject, duplicated body, or duplicated anatomy is present.","outcome":"pass"},{"criterionId":"complete-full-body","evaluator":"producer","observation":"The shaved-close-cropped head, both hands, polished seed case, trouser cuffs, flexible boot shafts, and both feet are fully visible inside generous top, side, and bottom parchment margins.","outcome":"pass"},{"criterionId":"painted-register","evaluator":"producer","observation":"Visible brush planes across skin, cloth, boots, and parchment, controlled illustrative facial detail, restrained warm response, and a soft grounding shadow establish the cinematic semi-realistic painted register without photographic, plastic-3D, or cel-anime drift.","outcome":"pass"},{"criterionId":"manifest-fidelity","evaluator":"producer","observation":"Delyn’s band-4 medium skin, adult wide-triangular face, softly lidded eyes, aquiline nose, full closed mouth, subtle age detail, black shaved close crop, plum-gray fitted vest over a soft shirt, high-waist trousers, offset closures, narrow reinforced cuffs, flexible boots, leading shoulder, direct gaze, and polished seed case are legible. However, small earrings add an accessory despite the frozen zero-accessory manifest, and the fitted athletic waist and defined limbs do not clearly preserve the required soft-round construction with an evident middle and gentle limb contours.","outcome":"fail"},{"criterionId":"neutral-expression","evaluator":"producer","observation":"The mouth is closed and unsmiling, with a steady direct gaze, settled brows, relaxed cheeks, and a calm neutral stance without grin or theatrical acting.","outcome":"pass"},{"criterionId":"one-star-ceiling","evaluator":"producer","observation":"The fitted cloth vest, soft shirt, practical trousers, reinforced cuffs, flexible boots, and seed case remain grounded mortal belongings. No weapon, armor, crown, magic, aura, glow, affinity cue, elemental gem, floating, frame, star, number, UI, logo, watermark, or text appears.","outcome":"pass"},{"criterionId":"original-identity","evaluator":"producer","observation":"Delyn’s wide-triangular face, shaved black crop, plum-gray fitted workwear, seed case, grounded stance, and identity are distinct from the reference woman, long side braid, ochre progression robes, ornaments, pose, anatomy, and identity; only the authorized painterly ceiling and parchment presentation carry over.","outcome":"pass"}],"generationCompletedAt":"2026-09-04T03:42:07.464Z","generationDurationMs":58620,"inspectionCompletedAt":"2026-09-04T03:42:57.368Z","inspectionDurationMs":49904,"persistence":{"operation":"anchored-exclusive-copy","retained":{"bytes":2497087,"height":1536,"mediaType":"image/png","path":"assets/heroes/experiments/one-star-overnight-200-001/waves/wave-06/candidates/delyn-dreno/summon-v1.png","sha256":"dae1cea4b17a7b5bd472504a33f6e9dcdb0ed2ed550a467a0963bfc85d180f11","width":1024},"source":{"bytes":2497087,"height":1536,"mediaType":"image/png","outputId":"exec-5c04d0a3-70f2-41a8-b706-6e0240ce9523","path":"/home/joao/.codex/generated_images/01a06a80-6191-7b83-8223-5af48735548c/exec-5c04d0a3-70f2-41a8-b706-6e0240ce9523.png","sha256":"dae1cea4b17a7b5bd472504a33f6e9dcdb0ed2ed550a467a0963bfc85d180f11","width":1024}},"precedingAttemptId":null,"promptSha256":"b568626f5ed817321fec95c63ee035b36a6ef3aee23841c9ad346ff5b215387b","referenceInputs":[{"path":"assets/heroes/visuals/style-references/current-hero-rendering/ochre-braid-progression-reference.png","sha256":"5b4a0f09271bc0fd1914614d50c4977cef6db50373d6357e9c5811aebb94f946"}],"requestStartedAt":"2026-09-04T03:41:08.844Z","retryReason":"A separately authorized versioned correction should remove only the unauthorized earrings and soften Delyn’s physique into the required rounded construction with an evident middle and gentle, non-defined limb contours. Preserve the accepted face, skin, shaved black crop, plum-gray fitted vest system, seed case, pose, full-body framing, painted register, neutral expression, one-star restraint, and original identity. No second generation call was authorized in this job.","sourceOutput":{"bytes":2497087,"height":1536,"mediaType":"image/png","outputId":"exec-5c04d0a3-70f2-41a8-b706-6e0240ce9523","path":"/home/joao/.codex/generated_images/01a06a80-6191-7b83-8223-5af48735548c/exec-5c04d0a3-70f2-41a8-b706-6e0240ce9523.png","sha256":"dae1cea4b17a7b5bd472504a33f6e9dcdb0ed2ed550a467a0963bfc85d180f11","width":1024},"totalWallTimeMs":108524}],"attestations":{"candidateOnly":true,"noSharedFilesEdited":true,"selfPromoted":false},"candidate":{"bytes":2497087,"height":1536,"mediaType":"image/png","path":"assets/heroes/experiments/one-star-overnight-200-001/waves/wave-06/candidates/delyn-dreno/summon-v1.png","sha256":"dae1cea4b17a7b5bd472504a33f6e9dcdb0ed2ed550a467a0963bfc85d180f11","width":1024},"completedAt":"2026-09-04T03:42:57.368Z","experimentId":"one-star-overnight-200-001","failedCriteria":["manifest-fidelity"],"producerId":"resume-lano","resultId":"delyn-dreno-summon-v1-result","schemaVersion":"hero-one-star-image-result-v1","selectedAttemptId":null,"startedAt":"2026-09-04T03:41:08.844Z","status":"revise","targetId":"delyn-dreno-summon-v1","targetSha256":"c47e333c2f602479d78a416dc6fc7cb53761c5f9d3c3e644f7ff73e6824c23f2","totalWallTimeMs":108524,"writtenOutputPaths":["assets/heroes/experiments/one-star-overnight-200-001/waves/wave-06/candidates/delyn-dreno/summon-v1.png","assets/heroes/experiments/one-star-overnight-200-001/waves/wave-06/results/delyn-dreno/summon-v1.json"]}
